simulations/k_sensitivity/combined/edf_binding_summary.csv

"configuration","model","method","K_smooth","mean_edf","mean_edf_ceiling","mean_edf_ratio","fraction_binding_90","fraction_binding_95","block"
"n=200, T=4","pl","bam_fd",10,7.79107123839667,10,0.779107123839667,0,0,"beta"
"n=200, T=4","pl","bam_fd",10,7.79107123839662,10,0.779107123839662,0,0,"beta"
"n=200, T=4","pl","bam_fd",20,9.55050766665499,20,0.477525383332749,0,0,"beta"
"n=200, T=4","pl","bam_fd",20,9.55050766600088,20,0.477525383300044,0,0,"beta"
"n=200, T=4","pl","bam_fd",40,9.81211838360354,40,0.245302959590089,0,0,"beta"
"n=200, T=4","pl","bam_fd",40,9.81211838295981,40,0.245302959573995,0,0,"beta"
"n=200, T=4","pl","bam_fe",10,7.59478531687296,9,0.843865035208106,0,0,"beta"
"n=200, T=4","pl","bam_fe",10,7.59478531687297,9,0.843865035208108,0,0,"beta"
"n=200, T=4","pl","bam_fe",20,9.03902043927146,19,0.475737917856393,0,0,"beta"
"n=200, T=4","pl","bam_fe",20,9.0390204395872,19,0.47573791787301,0,0,"beta"
"n=200, T=4","pl","bam_fe",40,9.23271397133871,39,0.236736255675352,0,0,"beta"
"n=200, T=4","pl","bam_fe",40,9.23271397122258,39,0.236736255672374,0,0,"beta"
"n=200, T=4","pl","bam_re",10,7.59937873516403,9,0.844375415018226,0,0,"beta"
"n=200, T=4","pl","bam_re",10,7.59905855505437,9,0.844339839450485,0,0,"beta"
"n=200, T=4","pl","bam_re",20,9.04838503101151,19,0.476230791105869,0,0,"beta"
"n=200, T=4","pl","bam_re",20,9.04838502952237,19,0.476230791027493,0,0,"beta"
"n=200, T=4","pl","bam_re",40,9.24288793297566,39,0.236997126486555,0,0,"beta"
"n=200, T=4","pl","bam_re",40,9.24288793300209,39,0.236997126487233,0,0,"beta"
"n=200, T=8","pl","bam_fd",10,8.30998484265798,10,0.830998484265798,0,0,"beta"
"n=200, T=8","pl","bam_fd",10,8.30998489152134,10,0.830998489152134,0,0,"beta"
"n=200, T=8","pl","bam_fd",20,11.0689470771654,20,0.55344735385827,0,0,"beta"
"n=200, T=8","pl","bam_fd",20,11.068946600702,20,0.553447330035102,0,0,"beta"
"n=200, T=8","pl","bam_fd",40,11.5692085191848,40,0.28923021297962,0,0,"beta"
"n=200, T=8","pl","bam_fd",40,11.5692072298259,40,0.289230180745647,0,0,"beta"
"n=200, T=8","pl","bam_fe",10,8.06068176974739,9,0.89563130774971,0.285,0,"beta"
"n=200, T=8","pl","bam_fe",10,8.06068162956018,9,0.895631292173353,0.285,0,"beta"
"n=200, T=8","pl","bam_fe",20,10.1619893004044,19,0.534841542126547,0,0,"beta"
"n=200, T=8","pl","bam_fe",20,10.1619897207495,19,0.534841564249975,0,0,"beta"
"n=200, T=8","pl","bam_fe",40,10.4830615814428,39,0.268796450806226,0,0,"beta"
"n=200, T=8","pl","bam_fe",40,10.483061768549,39,0.268796455603821,0,0,"beta"
"n=200, T=8","pl","bam_re",10,8.06144082475779,9,0.89571564719531,0.284,0,"beta"
"n=200, T=8","pl","bam_re",10,8.06144067843937,9,0.895715630937708,0.284,0,"beta"
"n=200, T=8","pl","bam_re",20,10.1631655830164,19,0.534903451737703,0,0,"beta"
"n=200, T=8","pl","bam_re",20,10.1631660058853,19,0.534903473993965,0,0,"beta"
"n=200, T=8","pl","bam_re",40,10.4841456122417,39,0.268824246467737,0,0,"beta"
"n=200, T=8","pl","bam_re",40,10.4844047553811,39,0.268830891163619,0,0,"beta"
"n=500, T=4","pl","bam_fd",10,8.33803103392016,10,0.833803103392016,0,0,"beta"
"n=500, T=4","pl","bam_fd",10,8.33803042942277,10,0.833803042942277,0,0,"beta"
"n=500, T=4","pl","bam_fd",20,11.1591284336711,20,0.557956421683556,0,0,"beta"
"n=500, T=4","pl","bam_fd",20,11.159121108144,20,0.5579560554072,0,0,"beta"
"n=500, T=4","pl","bam_fd",40,11.6755527165164,40,0.291888817912909,0,0,"beta"
"n=500, T=4","pl","bam_fd",40,11.6755442657882,40,0.291888606644704,0,0,"beta"
"n=500, T=4","pl","bam_fe",10,8.20675581430952,9,0.911861757145503,0.988,0,"beta"
"n=500, T=4","pl","bam_fe",10,8.20675540045118,9,0.911861711161242,0.988,0,"beta"
"n=500, T=4","pl","bam_fe",20,10.6258714868068,19,0.559256394042462,0,0,"beta"
"n=500, T=4","pl","bam_fe",20,10.6258744636304,19,0.55925655071739,0,0,"beta"
"n=500, T=4","pl","bam_fe",40,11.0209052470386,39,0.282587314026631,0,0,"beta"
"n=500, T=4","pl","bam_fe",40,11.0209084401432,39,0.282587395901109,0,0,"beta"
"n=500, T=4","pl","bam_re",10,8.21005459132824,9,0.91222828792536,0.99,0,"beta"
"n=500, T=4","pl","bam_re",10,8.20819454728763,9,0.912021616365292,0.986,0,"beta"
"n=500, T=4","pl","bam_re",20,10.6375048721969,19,0.55986867748405,0,0,"beta"
"n=500, T=4","pl","bam_re",20,10.637507779706,19,0.559868830510843,0,0,"beta"
"n=500, T=4","pl","bam_re",40,11.0340329840364,39,0.282923922667601,0,0,"beta"
"n=500, T=4","pl","bam_re",40,11.0340360512208,39,0.282924001313355,0,0,"beta"
"n=200, T=4","np","bam_fd",10,7.80590471693975,10,0.780590471693975,0,0,"coverage"
"n=200, T=4","np","bam_fd",20,9.57383159976847,20,0.478691579988423,0,0,"coverage"
"n=200, T=4","np","bam_fd",40,9.83694646060571,40,0.245923661515143,0,0,"coverage"
"n=200, T=4","np","bam_fe",10,7.60615571064998,9,0.845128412294443,0,0,"coverage"
"n=200, T=4","np","bam_fe",20,9.05908618567531,19,0.476794009772385,0,0,"coverage"
"n=200, T=4","np","bam_fe",40,9.25632965319475,39,0.237341785979352,0,0,"coverage"
"n=200, T=4","np","bam_re",10,7.61123482832877,9,0.845692758703197,0,0,"coverage"
"n=200, T=4","np","bam_re",20,9.06949286171959,19,0.477341729564189,0,0,"coverage"
"n=200, T=4","np","bam_re",40,9.26742399655873,39,0.237626256322019,0,0,"coverage"
"n=200, T=4","pl","bam_fd",10,7.79009870579709,10,0.779009870579708,0,0,"coverage"
"n=200, T=4","pl","bam_fd",20,9.53631493726287,20,0.476815746863144,0,0,"coverage"
"n=200, T=4","pl","bam_fd",40,9.79518192064182,40,0.244879548016045,0,0,"coverage"
"n=200, T=4","pl","bam_fe",10,7.59244311349946,9,0.843604790388829,0.00199999999999996,0,"coverage"
"n=200, T=4","pl","bam_fe",20,9.02658901134524,19,0.475083632176065,0,0,"coverage"
"n=200, T=4","pl","bam_fe",40,9.22108694887455,39,0.236438126894219,0,0,"coverage"
"n=200, T=4","pl","bam_re",10,7.5970098666024,9,0.844112207400267,0.00199999999999996,0,"coverage"
"n=200, T=4","pl","bam_re",20,9.03614014741648,19,0.475586323548236,0,0,"coverage"
"n=200, T=4","pl","bam_re",40,9.23112947131462,39,0.236695627469606,0,0,"coverage"
"n=200, T=8","np","bam_fd",10,8.31538863302238,10,0.831538863302238,0,0,"coverage"
"n=200, T=8","np","bam_fd",20,11.0956163121392,20,0.55478081560696,0,0,"coverage"
"n=200, T=8","np","bam_fd",40,11.5977612137153,40,0.289944030342882,0,0,"coverage"
"n=200, T=8","np","bam_fe",10,8.05974835251425,9,0.895527594723805,0.262,0,"coverage"
"n=200, T=8","np","bam_fe",20,10.1623530174708,19,0.534860685130043,0,0,"coverage"
"n=200, T=8","np","bam_fe",40,10.4836656100464,39,0.268811938719138,0,0,"coverage"
"n=200, T=8","np","bam_re",10,8.0605086265414,9,0.895612069615711,0.255000000000004,0,"coverage"
"n=200, T=8","np","bam_re",20,10.1643509133594,19,0.534965837545233,0,0,"coverage"
"n=200, T=8","np","bam_re",40,10.4860253340187,39,0.268872444462017,0,0,"coverage"
"n=200, T=8","pl","bam_fd",10,8.30694175384815,10,0.830694175384815,0,0,"coverage"
"n=200, T=8","pl","bam_fd",20,11.0709296267264,20,0.553546481336318,0,0,"coverage"
"n=200, T=8","pl","bam_fd",40,11.5749270771816,40,0.28937317692954,0,0,"coverage"
"n=200, T=8","pl","bam_fe",10,8.0614134204149,9,0.895712602268322,0.263999999999996,0,"coverage"
"n=200, T=8","pl","bam_fe",20,10.183986698205,19,0.535999299905527,0,0,"coverage"
"n=200, T=8","pl","bam_fe",40,10.5089493042517,39,0.269460238570558,0,0,"coverage"
"n=200, T=8","pl","bam_re",10,8.06224356413517,9,0.895804840459463,0.262,0,"coverage"
"n=200, T=8","pl","bam_re",20,10.1857669267518,19,0.536092996144832,0,0,"coverage"
"n=200, T=8","pl","bam_re",40,10.5109255489388,39,0.269510911511252,0,0,"coverage"
"n=500, T=4","np","bam_fd",10,8.35065263767148,10,0.835065263767148,0,0,"coverage"
"n=500, T=4","np","bam_fd",20,11.2057206300611,20,0.560286031503055,0,0,"coverage"
"n=500, T=4","np","bam_fd",40,11.7285084815112,40,0.293212712037779,0,0,"coverage"
"n=500, T=4","np","bam_fe",10,8.21355317593647,9,0.912617019548497,0.990000000000002,0,"coverage"
"n=500, T=4","np","bam_fe",20,10.6426216139066,19,0.560137979679296,0,0,"coverage"
"n=500, T=4","np","bam_fe",40,11.0359121644874,39,0.282972106781729,0,0,"coverage"
"n=500, T=4","np","bam_re",10,8.21597232387894,9,0.912885813764326,0.988999999999998,0,"coverage"
"n=500, T=4","np","bam_re",20,10.6526030897623,19,0.560663320513806,0,0,"coverage"
"n=500, T=4","np","bam_re",40,11.0474212552404,39,0.28326721167283,0,0,"coverage"
"n=500, T=4","pl","bam_fd",10,8.33958576102371,10,0.833958576102371,0,0,"coverage"
"n=500, T=4","pl","bam_fd",20,11.1725239707837,20,0.558626198539184,0,0,"coverage"
"n=500, T=4","pl","bam_fd",40,11.689507276241,40,0.292237681906026,0,0,"coverage"
"n=500, T=4","pl","bam_fe",10,8.20731696803417,9,0.911924107559353,0.987000000000001,0,"coverage"
"n=500, T=4","pl","bam_fe",20,10.6288776925252,19,0.559414615396062,0,0,"coverage"
"n=500, T=4","pl","bam_fe",40,11.020847302622,39,0.282585828272359,0,0,"coverage"
"n=500, T=4","pl","bam_re",10,8.21047600698648,9,0.912275111887386,0.990000000000001,0,"coverage"
"n=500, T=4","pl","bam_re",20,10.640434499174,19,0.560022868377577,0,0,"coverage"
"n=500, T=4","pl","bam_re",40,11.0339469711559,39,0.282921717209125,0,0,"coverage"
"n=200, T=4","linear","mgcv::bam FD",10,1.44743136200545,10,0.144743136200545,0,0,"mse"
"n=200, T=4","linear","mgcv::bam FD",20,1.45686536479081,20,0.0728432682395407,0,0,"mse"
"n=200, T=4","linear","mgcv::bam FD",40,1.45774565640573,40,0.0364436414101432,0,0,"mse"
"n=200, T=4","linear","mgcv::bam FE",10,1.3166007741142,9,0.146288974901578,0,0,"mse"
"n=200, T=4","linear","mgcv::bam FE",20,1.32406653053029,19,0.0696877121331731,0,0,"mse"
"n=200, T=4","linear","mgcv::bam FE",40,1.32009446612252,39,0.0338485760544236,0,0,"mse"
"n=200, T=4","linear","mgcv::bam RE",10,1.31105012541441,9,0.145672236157156,0,0,"mse"
"n=200, T=4","linear","mgcv::bam RE",20,1.31705661254924,19,0.0693187690815391,0,0,"mse"
"n=200, T=4","linear","mgcv::bam RE",40,1.38268908809846,39,0.0354535663614989,0,0,"mse"
"n=200, T=4","quadratic","mgcv::bam FD",10,3.97999607547948,10,0.397999607547948,0,0,"mse"
"n=200, T=4","quadratic","mgcv::bam FD",20,4.06381736465152,20,0.203190868232576,0,0,"mse"
"n=200, T=4","quadratic","mgcv::bam FD",40,4.07263098044876,40,0.101815774511219,0,0,"mse"
"n=200, T=4","quadratic","mgcv::bam FE",10,3.72005946039179,9,0.413339940043532,0,0,"mse"
"n=200, T=4","quadratic","mgcv::bam FE",20,3.77805171067155,19,0.19884482687745,0,0,"mse"
"n=200, T=4","quadratic","mgcv::bam FE",40,3.78428252447748,39,0.0970328852430123,0,0,"mse"
"n=200, T=4","quadratic","mgcv::bam RE",10,3.72237896857378,9,0.413597663174864,0,0,"mse"
"n=200, T=4","quadratic","mgcv::bam RE",20,3.78256577290321,19,0.199082409100169,0,0,"mse"
"n=200, T=4","quadratic","mgcv::bam RE",40,3.80027865876713,39,0.0974430425324904,0,0,"mse"
"n=200, T=4","sin_2pi","mgcv::bam FD",10,8.53952314403697,10,0.853952314403697,0,0,"mse"
"n=200, T=4","sin_2pi","mgcv::bam FD",20,12.0452411537739,20,0.602262057688694,0,0,"mse"
"n=200, T=4","sin_2pi","mgcv::bam FD",40,12.7732655091794,40,0.319331637729486,0,0,"mse"
"n=200, T=4","sin_2pi","mgcv::bam FE",10,8.43787834112568,9,0.937542037902853,1,0.006,"mse"
"n=200, T=4","sin_2pi","mgcv::bam FE",20,11.4903556218919,19,0.60475555904694,0,0,"mse"
"n=200, T=4","sin_2pi","mgcv::bam FE",40,12.0467954975085,39,0.308892192243809,0,0,"mse"
"n=200, T=4","sin_2pi","mgcv::bam RE",10,8.43613294100908,9,0.937348104556564,0.996,0.006,"mse"
"n=200, T=4","sin_2pi","mgcv::bam RE",20,11.493144735766,19,0.604902354514002,0,0,"mse"
"n=200, T=4","sin_2pi","mgcv::bam RE",40,12.0502244215023,39,0.308980113371855,0,0,"mse"
"n=200, T=8","linear","mgcv::bam FD",10,1.48094999466076,10,0.148094999466076,0,0,"mse"
"n=200, T=8","linear","mgcv::bam FD",20,1.4988134777344,20,0.07494067388672,0,0,"mse"
"n=200, T=8","linear","mgcv::bam FD",40,1.50030658663139,40,0.0375076646657849,0,0,"mse"
"n=200, T=8","linear","mgcv::bam FE",10,1.31323273667889,9,0.145914748519876,0,0,"mse"
"n=200, T=8","linear","mgcv::bam FE",20,1.3301768819645,19,0.0700093095770791,0,0,"mse"
"n=200, T=8","linear","mgcv::bam FE",40,1.33035156624464,39,0.0341115786216575,0,0,"mse"
"n=200, T=8","linear","mgcv::bam RE",10,1.31441404932527,9,0.146046005480585,0,0,"mse"
"n=200, T=8","linear","mgcv::bam RE",20,1.33169403362885,19,0.0700891596646765,0,0,"mse"
"n=200, T=8","linear","mgcv::bam RE",40,1.34627218982948,39,0.0345197997392173,0,0,"mse"
"n=200, T=8","quadratic","mgcv::bam FD",10,4.68628019543142,10,0.468628019543142,0,0,"mse"
"n=200, T=8","quadratic","mgcv::bam FD",20,4.84680161649749,20,0.242340080824874,0,0,"mse"
"n=200, T=8","quadratic","mgcv::bam FD",40,4.86458950428869,40,0.121614737607217,0,0,"mse"
"n=200, T=8","quadratic","mgcv::bam FE",10,4.2353900557517,9,0.470598895083522,0,0,"mse"
"n=200, T=8","quadratic","mgcv::bam FE",20,4.32824928236545,19,0.227802593808708,0,0,"mse"
"n=200, T=8","quadratic","mgcv::bam FE",40,4.33816035428613,39,0.111234880879132,0,0,"mse"
"n=200, T=8","quadratic","mgcv::bam RE",10,4.23582206066067,9,0.470646895628963,0,0,"mse"
"n=200, T=8","quadratic","mgcv::bam RE",20,4.32867631482738,19,0.227825069201441,0,0,"mse"
"n=200, T=8","quadratic","mgcv::bam RE",40,4.34263790414808,39,0.111349689849951,0,0,"mse"
"n=200, T=8","sin_2pi","mgcv::bam FD",10,8.77798068997146,10,0.877798068997146,0,0,"mse"
"n=200, T=8","sin_2pi","mgcv::bam FD",20,13.7048357214357,20,0.685241786071787,0,0,"mse"
"n=200, T=8","sin_2pi","mgcv::bam FD",40,15.0578954224824,40,0.37644738556206,0,0,"mse"
"n=200, T=8","sin_2pi","mgcv::bam FE",10,8.67044102595142,9,0.963382336216825,1,1,"mse"
"n=200, T=8","sin_2pi","mgcv::bam FE",20,12.7445738101927,19,0.670767042641724,0,0,"mse"
"n=200, T=8","sin_2pi","mgcv::bam FE",40,13.6432159083427,39,0.349826048931863,0,0,"mse"
"n=200, T=8","sin_2pi","mgcv::bam RE",10,8.66452598861733,9,0.962725109846371,0.992,0.992,"mse"
"n=200, T=8","sin_2pi","mgcv::bam RE",20,12.7447996331953,19,0.67077892806291,0,0,"mse"
"n=200, T=8","sin_2pi","mgcv::bam RE",40,13.6433887667326,39,0.349830481198272,0,0,"mse"
"n=500, T=4","linear","mgcv::bam FD",10,1.47572872647049,10,0.147572872647049,0,0,"mse"
"n=500, T=4","linear","mgcv::bam FD",20,1.48703434916188,20,0.0743517174580941,0,0,"mse"
"n=500, T=4","linear","mgcv::bam FD",40,1.48842227204481,40,0.0372105568011203,0,0,"mse"
"n=500, T=4","linear","mgcv::bam FE",10,1.33893740869544,9,0.148770823188382,0,0,"mse"
"n=500, T=4","linear","mgcv::bam FE",20,1.3416224640957,19,0.0706117086366155,0,0,"mse"
"n=500, T=4","linear","mgcv::bam FE",40,1.34198379601584,39,0.0344098409234831,0,0,"mse"
"n=500, T=4","linear","mgcv::bam RE",10,1.33224769224487,9,0.148027521360541,0,0,"mse"
"n=500, T=4","linear","mgcv::bam RE",20,1.33581430200906,19,0.0703060158952138,0,0,"mse"
"n=500, T=4","linear","mgcv::bam RE",40,1.34488087632774,39,0.0344841250340445,0,0,"mse"
"n=500, T=4","quadratic","mgcv::bam FD",10,4.73289503598513,10,0.473289503598513,0,0,"mse"
"n=500, T=4","quadratic","mgcv::bam FD",20,4.89578006533927,20,0.244789003266964,0,0,"mse"
"n=500, T=4","quadratic","mgcv::bam FD",40,4.9132486537096,40,0.12283121634274,0,0,"mse"
"n=500, T=4","quadratic","mgcv::bam FE",10,4.44870857054615,9,0.494300952282905,0,0,"mse"
"n=500, T=4","quadratic","mgcv::bam FE",20,4.56051305702193,19,0.240027003001154,0,0,"mse"
"n=500, T=4","quadratic","mgcv::bam FE",40,4.57258725851981,39,0.117245827141534,0,0,"mse"
"n=500, T=4","quadratic","mgcv::bam RE",10,4.44967900047339,9,0.494408777830377,0,0,"mse"
"n=500, T=4","quadratic","mgcv::bam RE",20,4.56126833118301,19,0.24006675427279,0,0,"mse"
"n=500, T=4","quadratic","mgcv::bam RE",40,4.58618269972575,39,0.117594428198096,0,0,"mse"
"n=500, T=4","sin_2pi","mgcv::bam FD",10,8.79159845838411,10,0.879159845838411,0,0,"mse"
"n=500, T=4","sin_2pi","mgcv::bam FD",20,13.8204614530887,20,0.691023072654435,0,0,"mse"
"n=500, T=4","sin_2pi","mgcv::bam FD",40,15.2189106273898,40,0.380472765684745,0,0,"mse"
"n=500, T=4","sin_2pi","mgcv::bam FE",10,8.73802352670188,9,0.970891502966876,1,1,"mse"
"n=500, T=4","sin_2pi","mgcv::bam FE",20,13.2568648122974,19,0.697729726963022,0,0,"mse"
"n=500, T=4","sin_2pi","mgcv::bam FE",40,14.3437431962969,39,0.367788287084537,0,0,"mse"
"n=500, T=4","sin_2pi","mgcv::bam RE",10,8.72479168675078,9,0.969421298527864,0.983,0.983,"mse"
"n=500, T=4","sin_2pi","mgcv::bam RE",20,13.2596487710329,19,0.697876251106995,0,0,"mse"
"n=500, T=4","sin_2pi","mgcv::bam RE",40,14.3474400964523,39,0.367883079396212,0,0,"mse"

simulations/k_sensitivity/RESULTS.md

### EDF can increase with sample size at fixed K

The simulations directly illustrate this point. For the sine RMSE design, the
average levels-FE EDF at fixed `K = 10` rises from 8.44 for `(200,4)` to 8.67
for `(200,8)` and 8.74 for `(500,4)`, against a ceiling of 9. At fixed `K = 20`,
it rises from 11.49 to 12.74 and 13.26, against a ceiling of 19. At fixed
`K = 40`, it rises from 12.05 to 13.64 and 14.34, against a ceiling of 39.